{
  "foundation_version": "0.15.0",
  "court_length_unit": 1,
  "speed_units": "ft_per_s",
  "tick_seconds": 0.1,
  "arrival_epsilon_ft": 1.5,
  "max_accel_fts2": 44,
  "default_action_speeds": {
    "advance": 14.1,
    "cut": 20.7,
    "space": 18.5,
    "screen": 7.5,
    "ball_handler": 13.2,
    "on_ball_defend": 16.0,
    "help": 15.5,
    "deny": 12.5,
    "tag": 13.5,
    "weak_side": 11.5,
    "box_out": 9.4,
    "inbound": 9.4,
    "receive_tip": 13.2,
    "jump": 4.7,
    "circle_spot": 5.6,
    "shoot_ft": 4.7,
    "idle": 3.8,
    "pass": 9.4,
    "drive": 18.8,
    "triple_threat": 2.4,
    "back_to_basket": 3.3,
    "pivot": 2.4,
    "crossover": 15.1,
    "pump_fake": 1.9,
    "shoot": 7.5,
    "pressure": 16.0,
    "contain": 15.0,
    "relocate": 16.9,
    "hold": 5.6
  },
  "player_overrides": {
    "1": {
      "advance": 14.1,
      "drive": 20.7,
      "cut": 22.6
    },
    "2": {
      "advance": 14.1,
      "drive": 20.7,
      "cut": 22.6
    },
    "3": {
      "advance": 14.1,
      "drive": 16.9,
      "cut": 20.7
    },
    "4": {
      "advance": 13.2,
      "drive": 14.1,
      "cut": 23.5
    },
    "5": {
      "advance": 13.2,
      "drive": 16.0,
      "cut": 19.7
    },
    "6": {
      "advance": 14.1,
      "drive": 16.9,
      "cut": 20.7
    },
    "7": {
      "advance": 14.1,
      "drive": 20.7,
      "cut": 22.6
    },
    "8": {
      "advance": 13.2,
      "drive": 14.1,
      "cut": 23.5
    },
    "9": {
      "advance": 14.1,
      "drive": 20.7,
      "cut": 22.6
    },
    "10": {
      "advance": 13.2,
      "drive": 16.0,
      "cut": 19.7
    },
    "11": {
      "advance": 14.1,
      "drive": 20.7,
      "cut": 22.6
    },
    "12": {
      "advance": 14.1,
      "drive": 20.7,
      "cut": 22.6
    },
    "13": {
      "advance": 14.1,
      "drive": 16.9,
      "cut": 20.7
    },
    "14": {
      "advance": 13.2,
      "drive": 14.1,
      "cut": 23.5
    },
    "15": {
      "advance": 13.2,
      "drive": 16.0,
      "cut": 19.7
    },
    "16": {
      "advance": 14.1,
      "drive": 16.9,
      "cut": 20.7
    },
    "17": {
      "advance": 14.1,
      "drive": 20.7,
      "cut": 22.6
    },
    "18": {
      "advance": 13.2,
      "drive": 14.1,
      "cut": 23.5
    },
    "19": {
      "advance": 14.1,
      "drive": 20.7,
      "cut": 22.6
    },
    "20": {
      "advance": 13.2,
      "drive": 16.0,
      "cut": 19.7
    }
  },
  "role_action_speeds": {
    "ball_handler": {
      "advance": 13.2,
      "drive": 20.7,
      "triple_threat": 2.4,
      "back_to_basket": 3.3,
      "pivot": 2.4,
      "crossover": 16.9,
      "pump_fake": 1.9,
      "cut": 22.6,
      "relocate": 14.1,
      "ball_handler": 14.1
    },
    "screener": {
      "advance": 13.2,
      "drive": 14.1,
      "cut": 23.5,
      "screen": 16.9,
      "space": 9.4,
      "relocate": 15.1
    },
    "spacer": {
      "advance": 14.1,
      "drive": 16.9,
      "cut": 20.7,
      "space": 18.5,
      "relocate": 18.0
    },
    "on_ball_defender": {
      "on_ball_defend": 16.0,
      "deny": 13.5,
      "help": 14.5,
      "tag": 13.5
    },
    "help_defender": {
      "help": 15.5,
      "tag": 13.5,
      "box_out": 12,
      "weak_side": 11.5
    },
    "weak_side_defender": {
      "weak_side": 11.5,
      "deny": 12.5,
      "help": 14.5,
      "box_out": 12
    },
    "perimeter_defender": {
      "deny": 12.5,
      "help": 14.5,
      "weak_side": 11.5,
      "box_out": 12
    }
  },
  "physical": {
    "body_radius_ft": 1,
    "pressure_radius_ft": 6,
    "pressure_speed_floor": 0.7,
    "contact_iterations": 4,
    "dead_ball_speed_scale": 0.75
  },
  "ball": {
    "pass_speed": 0.45,
    "shot_flight_min": 0.35,
    "shot_flight_max": 1.5,
    "shot_flight_speed": 0.22,
    "intercept_radius": 0.065,
    "strip_radius": 0.035,
    "loose_pickup_radius": 0.1
  }
}